CREATE EXTENSION pg_duckpipe CASCADE;
SELECT duckpipe.start_worker();
NOTICE:  Worker already running for database regression
 start_worker 
--------------
 
(1 row)

CREATE TABLE stream_test (id int primary key, val text);
CREATE TABLE ducklake.stream_test (id int, val text) USING ducklake;
SELECT duckpipe.add_table('public.stream_test', 'ducklake.stream_test', 'default', false);
 add_table 
-----------
 
(1 row)

INSERT INTO stream_test VALUES (1, 'one');
INSERT INTO stream_test VALUES (2, 'two');
SELECT pg_sleep(2);
 pg_sleep 
----------
 
(1 row)

SELECT * FROM ducklake.stream_test ORDER BY id;
 id | val 
----+-----
  1 | one
  2 | two
(2 rows)

-- Test UPDATE (should be handled as DELETE + INSERT)
UPDATE stream_test SET val = 'updated_two' WHERE id = 2;
SELECT pg_sleep(2);
 pg_sleep 
----------
 
(1 row)

SELECT * FROM ducklake.stream_test ORDER BY id;
 id |     val     
----+-------------
  1 | one
  2 | updated_two
(2 rows)

DELETE FROM stream_test WHERE id = 1;
SELECT pg_sleep(2);
 pg_sleep 
----------
 
(1 row)

SELECT * FROM ducklake.stream_test ORDER BY id;
 id |     val     
----+-------------
  2 | updated_two
(1 row)

SELECT duckpipe.remove_table('public.stream_test', false);
 remove_table 
--------------
 
(1 row)

DROP TABLE ducklake.stream_test;
DROP TABLE stream_test;
SET client_min_messages = warning;
SELECT duckpipe.stop_worker();
 stop_worker 
-------------
 
(1 row)

RESET client_min_messages;
DROP EXTENSION pg_duckpipe CASCADE;
