-- TOAST unchanged columns become NULL
--
-- Bug: When an UPDATE doesn't modify a TOASTed column (>2KB), pgoutput sends
-- status 'u' (unchanged) with no data. decoder.c converts this to NULL.
-- Since UPDATEs are DELETE + INSERT, the INSERT writes NULL for the unchanged
-- TOAST column, silently corrupting data.
SET client_min_messages = warning;
SELECT duckpipe.start_worker();
 start_worker 
--------------
 
(1 row)

RESET client_min_messages;
CREATE TABLE toast_test (id int PRIMARY KEY, small_col text, big_col text);
-- Force TOAST storage for big_col so pgoutput sends 'u' for unchanged values
ALTER TABLE toast_test ALTER COLUMN big_col SET STORAGE EXTERNAL;
SELECT duckpipe.add_table('public.toast_test', NULL, 'default', false);
 add_table 
-----------
 
(1 row)

-- Insert rows with large text (well above TOAST threshold)
INSERT INTO toast_test VALUES (1, 'small_1', repeat('x', 10000));
INSERT INTO toast_test VALUES (2, 'small_2', repeat('y', 10000));
SELECT pg_sleep(2);
 pg_sleep 
----------
 
(1 row)

-- Verify initial sync
SELECT id, small_col, length(big_col) AS big_col_len
FROM public.toast_test_ducklake ORDER BY id;
 id | small_col | big_col_len 
----+-----------+-------------
  1 | small_1   |       10000
  2 | small_2   |       10000
(2 rows)

-- Update only small_col (big_col unchanged → pgoutput sends status 'u')
UPDATE toast_test SET small_col = 'updated_1' WHERE id = 1;
UPDATE toast_test SET small_col = 'updated_2' WHERE id = 2;
SELECT pg_sleep(2);
 pg_sleep 
----------
 
(1 row)

-- Verify: big_col must be preserved, not NULL
SELECT id, small_col, length(big_col) AS big_col_len,
       big_col IS NULL AS big_col_is_null
FROM public.toast_test_ducklake ORDER BY id;
 id | small_col | big_col_len | big_col_is_null 
----+-----------+-------------+-----------------
  1 | updated_1 |       10000 | f
  2 | updated_2 |       10000 | f
(2 rows)

-- Also test: update big_col itself (should work normally)
UPDATE toast_test SET big_col = repeat('z', 10000) WHERE id = 1;
SELECT pg_sleep(2);
 pg_sleep 
----------
 
(1 row)

SELECT id, small_col, length(big_col) AS big_col_len
FROM public.toast_test_ducklake ORDER BY id;
 id | small_col | big_col_len 
----+-----------+-------------
  1 | updated_1 |       10000
  2 | updated_2 |       10000
(2 rows)

-- Cleanup: stop worker first so DuckDB connections are released
SET client_min_messages = warning;
SELECT duckpipe.stop_worker();
 stop_worker 
-------------
 
(1 row)

RESET client_min_messages;
SELECT duckpipe.remove_table('public.toast_test', false);
WARNING:  Group 'default' has no remaining tables — its replication slot is still holding WAL. Run SELECT duckpipe.drop_group('default') to release it.
 remove_table 
--------------
 
(1 row)

DROP TABLE public.toast_test_ducklake;
DROP TABLE toast_test;
